{
  "$schema": "../schemas/win2apk-v2.schema.json",
  "schemaVersion": 2,
  "project": {
    "name": "Cuphead",
    "sourceFolder": "/home/julian/Games/cuphead/drive_c/Program Files/Cuphead",
    "entrypoint": "Cuphead.exe",
    "installDirectory": "Cuphead"
  },
  "android": {
    "applicationId": "com.cuphead",
    "versionCode": 48,
    "versionName": "11.1-direct-files-auto-gpu-recovery-v15-pixel-bcn-legacy-exec-16k-cuphead-core",
    "icon": "../assets/icons/cuphead-promo-logo.png",
    "iconBackgroundColor": "#FFCC16",
    "rootfsPackageId": "com.winlator",
    "rootfsPathAlias": "/proc/self/fd/3",
    "pathRewriteAssets": [
      "rootfs.tzst",
      "rootfs_patches.tzst",
      "container_pattern.tzst",
      "box64/box64-0.4.0.tzst",
      "graphics_driver/gladio-1.0.tzst",
      "graphics_driver/turnip-26.1.0.tzst",
      "graphics_driver/virgl-23.1.9.tzst",
      "graphics_driver/vortek-2.1.tzst"
    ]
  },
  "packaging": {
    "delivery": "on-demand",
    "storageMode": "move",
    "targetPackBytes": 1350000000,
    "oversizedFiles": "chunk"
  },
  "distribution": {
    "aab": true,
    "apks": true,
    "localTesting": true
  },
  "signing": {
    "profile": "auto"
  },
  "startup": {
    "coreMode": true,
    "autoLaunch": true,
    "showGeneralInterface": false,
    "minimalLoading": true,
    "requestStoragePermission": false,
    "closeCoreWhenApplicationExits": true,
    "errorMode": "technical_dialog",
    "loadingText": "Preparing application..."
  },
  "runtime": {
    "appTheme": "dark",
    "soundfont": "",
    "midiInputDevice": "auto",
    "box64Version": "",
    "box64Logs": 0,
    "saveLogsToFile": false,
    "logFile": "",
    "useAndroidClipboardOnWine": false,
    "enableWineDebug": false,
    "wineDebugChannels": "warn,err,fixme",
    "openAndroidBrowserFromWine": true,
    "cursorColor": 16777215,
    "cursorScale": 1.0,
    "cursorSpeed": 1.0,
    "capturePointerOnExternalMouse": true,
    "moveCursorToTouchpoint": false,
    "overlayOpacity": 0.4,
    "gamepadModel": "",
    "languageIndex": -1
  },
  "shortcut": {
    "name": "Cuphead",
    "execArguments": "",
    "forceFullscreen": false
  },
  "container": {
    "name": "Container-1",
    "screenSize": "1280x720",
    "envVars": "ZINK_DESCRIPTORS=lazy ZINK_DEBUG=compact MESA_SHADER_CACHE_DISABLE=false MESA_SHADER_CACHE_MAX_SIZE=512MB mesa_glthread=true WINEESYNC=1 TU_DEBUG=noconform",
    "cpuList": "auto",
    "cpuListWoW64": "auto",
    "graphicsDriver": "auto",
    "graphicsDriverConfig": "",
    "dxwrapper": "auto",
    "dxwrapperConfig": "",
    "audioDriver": "alsa",
    "audioDriverConfig": "",
    "wincomponents": "direct3d=1,directsound=1,directmusic=1,directshow=0,directplay=0,xaudio=1,vcrun2005=0,vcrun2010=1,wmdecoder=1",
    "drives": "D:${DOWNLOADS}E:${INTERNAL_STORAGE}",
    "hudMode": 0,
    "startupSelection": 1,
    "box64Preset": "INTERMEDIATE",
    "desktopTheme": "LIGHT,IMAGE,#0277bd",
    "wineVersion": ""
  }
}
